[
  {
    "fixture_id": "formo-synth-wav-001",
    "source_type": "synthetic",
    "license": "CC0-1.0",
    "format": "wav",
    "duration_ms": 5000,
    "description": "合成客語四縣腔短句 WAV，用於驗證 FormoSpeech Whisper-v3 基本推論流程。"
  },
  {
    "fixture_id": "formo-synth-m4a-001",
    "source_type": "synthetic",
    "license": "CC0-1.0",
    "format": "m4a",
    "duration_ms": 5000,
    "description": "合成客語四縣腔短句 M4A，用於驗證 M4A 解碼流程。"
  }
]
