[
  {
    "fixture_id": "ce-synth-wav-zh-001",
    "source_type": "synthetic",
    "license": "CC0-1.0",
    "format": "wav",
    "duration_ms": 3200,
    "description": "專案合成的華語短句 WAV 測試音檔，用於驗證 CE 模型 zh 推論流程。"
  },
  {
    "fixture_id": "ce-synth-wav-hak-001",
    "source_type": "synthetic",
    "license": "CC0-1.0",
    "format": "wav",
    "duration_ms": 4100,
    "description": "專案合成的客語短句 WAV 測試音檔，用於驗證 CE 模型 hak 推論流程。"
  },
  {
    "fixture_id": "ce-synth-m4a-zh-001",
    "source_type": "synthetic",
    "license": "CC0-1.0",
    "format": "m4a",
    "duration_ms": 3500,
    "description": "專案合成的華語短句 M4A 測試音檔，用於驗證 M4A 解碼後推論流程。"
  }
]
